scientific_name;genus;country_id;locality;ddlat;ddlong;recorded_by;colnum_full;col_day;col_month;col_year;det_by;det_date;institute;herbarium_code;orig_bc;specificEpithet;species_author;collector_id;prefix;sufix;col_date;det_day;det_month;det_year;country;continent;coordinate_id;barcode;colnum;specific_epithet;orig_recby;orig_detby;coll_surname;to_check;to_check_det
Hornschuchia bryotrophe Nees;Hornschuchia;BR;Estrada do Tanguá, pelo do Rio Bonito;-22.708611;-42.609444;Kuhlmann, M ;;26;2;1951;Johnson, DM ;1994-01-01T00:00:00;NY;NY;NY00395784;0;0;0;;;0;1;1;1994;0;0;0;NY00395784;nan;bryotrophe;M. Kuhlmann;D. M. Johnson;Kuhlmann;;
Hornschuchia bryotrophe Nees;Hornschuchia;BR;Vittoria, Bahia.;;;Sellow, F ;;;;;nan;<NA>;B;B;B 10 0243155;0;0;0;;;0;;;;0;0;0;B0243155;nan;bryotrophe;F. Sellow;<NA>;Sellow;;
Hornschuchia bryotrophe Nees;Hornschuchia;BR;Estrada do Tanguá, pelo do Rio Bonito;-22.7124572;-42.6095271;Kuhlmann, M ;;26;2;1951;Johnson, DM ;1994-01-01T00:00:00;NY;NY;395784;0;0;0;;;0;1;1;1994;0;0;0;NY395784;nan;bryotrophe;M. Kuhlmann;D. M. Johnson;Kuhlmann;;
Hornschuchia myrtillus Nees;Hornschuchia;BR;In sylvis ad fl. Caxoeira prope Ferradas. Provinciae Bah.;;;Martius, CFP von;;;;;nan;<NA>;M;BSMvplantscoll;M-0240087 / 729597 / 376426;0;0;0;;;0;;;;0;0;0;M-376426;nan;myrtillus;Martius, C.F.P. von;<NA>;Martius;;
Hornschuchia myrtillus Nees;Hornschuchia;BR;In sylvis. Provinciae Rio d. J.;;;Martius, CFP von;;;;;nan;<NA>;M;BSMvplantscoll;M-0240086 / 729596 / 376425;0;0;0;;;0;;;;0;0;0;M-376425;nan;myrtillus;Martius, C.F.P. von;<NA>;Martius;;
Hornschuchia citriodora D.M.Johnson;Hornschuchia;BR;Fazenda Serra do Teimoso. Lower forest, northern portion of reserve. Southern Bahian moist forest with elements of semi-deciduos forest.;-15.153333;-39.530556;Thomas, WW ;;16;3;2003;nan;2012-06-01T00:00:00;JBRJ;RB;RB00485209;0;0;0;;;0;1;6;2012;0;0;0;RB00485209;nan;citriodora;"W.W. Thomas; A.M. Amorim, S. Sant´Ana, J.L. Paixão & R.N. Querino";A.Lobão;Thomas;;
Hornschuchia citriodora D.M.Johnson;Hornschuchia;BR;"Ca. 2,5 Km N of Palmira on road connecting palmira to the Itaju do Colônia-Itapé Road, fazenda São Roque (owner Luis Fernando Verde); mountain with transitional subdeciduous forest, some of it disturbed. Southern Bahian Mesophyllous forest.";-15.265555;-39.774722;Thomas, WW ;;14;3;2001;Lopes, JC ;<NA>;JBRJ;RB;RB00484198;0;0;0;;;0;;;;0;0;0;RB00484198;nan;citriodora;"W.W. Thomas; M. Longhi Wagner & Sant´Ana";J.C. Lopes;Thomas;;
Hornschuchia bryotrophe Nees;Hornschuchia;BR;Serra do Cipó . Serra do Cipó;;;Kuhlmann, JG;;16;1;1951;nan;<NA>;JBRJ;RB;RB00042164;0;0;0;;;0;;;;0;0;0;RB00042164;nan;bryotrophe;"J.G Kuhlmann; L.Edmundo";<NA>;Kuhlmann;;
Hornschuchia bryotrophe Nees;Hornschuchia;BR;Município de Maraú. ROd. Rod.BR 030, trecho Ubaitaba/Marau, km 15. Vegetação pertubada em Região de Mata Hidrográfica Sul bahiana. Folha SD 24 (14-39c).;;;Mori, SA;;5;2;1979;nan;<NA>;JBRJ;RB;RB00042161;0;0;0;;;0;;;;0;0;0;RB00042161;nan;bryotrophe;"S.A.Mori; L.A.Mattos Silva, T.S. dos Santos";J. Kallunki,;Mori;;
Hornschuchia bryotrophe Nees;Hornschuchia;BR;Município de Ibicaraí. Rodoviaria BR - 415, 40km Oeste de Itabuna. Região de Mata Hidrográfila Sul Baiana.;;;Mori, SA ;;2;3;1978;Kallunki, JA ;<NA>;JBRJ;RB;RB00042146;0;0;0;;;0;;;;0;0;0;RB00042146;nan;bryotrophe;"S.A. Mori; L.A. Mattos Silva, T. Soares dos Santos, J.A. Kallunki, T.D. Pennington";J.A. Kallunki;Mori;;
Hornschuchia bryotrophe Nees;Hornschuchia;BR;"Árvore de até 3 metros. de altura. mata rala; infl. geralmente deitadas sobre o solo.";;;Khulmann, JG ;;;;;nan;<NA>;JBRJ;RB;RB00042140;0;0;0;;;0;;;;0;0;0;RB00042140;nan;bryotrophe;J.G. Khulmann;D.M.Johnson (OWU);Khulmann;;
Hornschuchia bryotrophe Nees;Hornschuchia;BR;Estrada do Tanguá, perto de Rio Bonito. Rio Bonito;;;Kuhlm;;26;2;1951;Jhonson, DM ;<NA>;JBRJ;RB;RB00042134;0;0;0;;;0;;;;0;0;0;RB00042134;nan;bryotrophe;"Kuhlm. ;  Blacke";D.M. Jhonson;Kuhlm;;
Hornschuchia alba (A.St.-Hil.) R.E.Fr.;Hornschuchia;BR;Rancho Dez.;;;Farney, C ;;;6;1997;Farney, C ;2006-05-01T00:00:00;JBRJ;RB;RB00372099;0;0;0;;;0;1;5;2006;0;0;0;RB00372099;nan;alba;"C. Farney; D.S. Araújo, P.C. Feraz 7 A.Q. Lobão";C. Farney;Farney;;
Hornschuchia bryotrophe Nees;Hornschuchia;BR;Brazil: Vittoria, Bahia. Leg.: Sellow,F. s.n.;;;nan;;;;;nan;<NA>;B;Herbarium Berolinense;B 10 0243155;0;0;0;;;0;;;;0;0;0;B0243155;nan;bryotrophe;Sellow,F.;<NA>;;Sellow,F.;recby_problem
Hornschuchia alba (A.St.-Hil.) R.E.Fr.;Hornschuchia;BR;<NA>;;;nan;;;;;nan;<NA>;MNHN;P;P032535;0;0;0;;;0;;;;0;0;0;P032535;nan;alba;Saint-Hilaire, A. de;Johnson;;Saint-Hilaire, A. de;recby_problem
Hornschuchia obliqua Maas & van Setten;Hornschuchia;<NA>;<NA>;;;nan;;;;;nan;<NA>;MNHN;P;P01954536;0;0;0;;;0;;;;0;0;0;P01954536;nan;obliqua;<NA>;<NA>;;<NA>;recby_problem
Hornschuchia bryotrophe Nees;Hornschuchia;<NA>;<NA>;;;nan;;;;;nan;<NA>;MNHN;P;P01954539;0;0;0;;;0;;;;0;0;0;P01954539;nan;bryotrophe;<NA>;<NA>;;<NA>;recby_problem
Hornschuchia bryotrophe Nees;Hornschuchia;<NA>;<NA>;;;nan;;;;;nan;<NA>;MNHN;P;P01954537;0;0;0;;;0;;;;0;0;0;P01954537;nan;bryotrophe;<NA>;<NA>;;<NA>;recby_problem
Hornschuchia Nees;Hornschuchia;<NA>;<NA>;;;nan;;;;;nan;<NA>;MNHN;P;P01954540;0;0;0;;;0;;;;0;0;0;P01954540;nan;;<NA>;<NA>;;<NA>;recby_problem
Hornschuchia polyantha Maas;Hornschuchia;<NA>;<NA>;;;nan;;;;;Johnson, DM;<NA>;MNHN;P;P01954535;0;0;0;;;0;;;;0;0;0;P01954535;nan;polyantha;<NA>;<NA>;;<NA>;recby_problem
Hornschuchia bryotrophe Nees;Hornschuchia;<NA>;<NA>;;;Amorim, AM;;;;;nan;<NA>;MNHN;P;P01954538;0;0;0;;;0;;;;0;0;0;P01954538;nan;bryotrophe;<NA>;<NA>;;<NA>;recby_problem
Hornschuchia lianarum D.M.Johnson & N.A.Murray;Hornschuchia;<NA>;<NA>;;;Amorim, AM;;;;;nan;<NA>;MNHN;P;P01963658;0;0;0;;;0;;;;0;0;0;P01963658;nan;lianarum;<NA>;<NA>;;<NA>;recby_problem
Hornschuchia Nees;Hornschuchia;<NA>;<NA>;;;Sant'Ana, SC;;;;;Johnson, DM;<NA>;<NA>;<NA>;http://id.luomus.fi/C.14781;0;0;0;;;0;;;;0;0;0;C14781;nan;;<NA>;<NA>;;<NA>;recby_problem
Hornschuchia Nees;Hornschuchia;<NA>;<NA>;;;Santos, TS ;;;;;Mello-Silva, R de;<NA>;<NA>;<NA>;http://id.luomus.fi/C.14777;0;0;0;;;0;;;;0;0;0;C14777;nan;;<NA>;<NA>;;<NA>;recby_problem
Hornschuchia Nees;Hornschuchia;<NA>;<NA>;;;Santos, TS dos;;;;;Mello-Silva, R de;<NA>;<NA>;<NA>;http://id.luomus.fi/C.14778;0;0;0;;;0;;;;0;0;0;C14778;nan;;<NA>;<NA>;;<NA>;recby_problem
Hornschuchia Nees;Hornschuchia;<NA>;<NA>;;;Sellow, F;;;;;nan;<NA>;<NA>;<NA>;http://id.luomus.fi/C.14780;0;0;0;;;0;;;;0;0;0;C14780;nan;;<NA>;<NA>;;<NA>;recby_problem
Hornschuchia Nees;Hornschuchia;<NA>;<NA>;;;Tavares, S ;;;;;Maas, PJM, Maas, H, Erkens, RHJ;<NA>;<NA>;<NA>;http://id.luomus.fi/C.14779;0;0;0;;;0;;;;0;0;0;C14779;nan;;<NA>;<NA>;;<NA>;recby_problem
Hornschuchia bryotrophe Nees;Hornschuchia;BR;<NA>;;;nan;;;;;nan;<NA>;M;BSMvplantscoll;M-0240083 / 729593 / 376422;0;0;0;;;0;;;;0;0;0;M-376422;nan;bryotrophe;Martius, C.F.P. von (no. Herb. Fl. Bras. 858);<NA>;;von (no. Herb. Fl. Bras. 858);recby_problem
Hornschuchia bryotrophe Nees;Hornschuchia;BR;<NA>;;;nan;;;;;nan;<NA>;M;BSMvplantscoll;M-0240084 / 729594 / 376423;0;0;0;;;0;;;;0;0;0;M-376423;nan;bryotrophe;Martius, C.F.P. von (no. Herb. Fl. Bras. 858);<NA>;;von (no. Herb. Fl. Bras. 858);recby_problem
Hornschuchia myrtillus Nees;Hornschuchia;BR;In sylvis udis ad fl. da Caxoeira et Ferradas in Ilheos. Provinciae Bahiensis.;;;nan;;;12;1818;nan;<NA>;M;BSMvplantscoll;M-0240085 / 729595 / 376424;0;0;0;;;0;;;;0;0;0;M-376424;nan;myrtillus;Martius, C.F.P. von (no. Obs. 2101);<NA>;;von (no. Obs. 2101);recby_problem
Hornschuchia bryotrophe Nees;Hornschuchia;BR;[Bahia, via Filisbertia].;;;nan;;;;;nan;<NA>;M;BSMvplantscoll;M-0240081 / 729591 / 376420;0;0;0;;;0;;;;0;0;0;M-376420;nan;bryotrophe;Wied-Neuwied, M.A.P. zu (no. 34);<NA>;;Wied-Neuwied, M.A.P. zu (no. 34);recby_problem
Hornschuchia bryotrophe Nees;Hornschuchia;BR;Castelnovo.;;;nan;;;;;nan;<NA>;M;BSMvplantscoll;M-0240082 / 729592 / 376421;0;0;0;;;0;;;;0;0;0;M-376421;nan;bryotrophe;Riedel, L. (no. 711);<NA>;;(no. 711);recby_problem
Bocagea alba A.St.-Hil.;Hornschuchia;BR;<NA>;;;nan;;;;;nan;<NA>;UM;MPU;MPU026907;0;0;0;;;0;;;;0;0;0;MPU026907;nan;alba;Saint-Hilaire, A. de;<NA>;;Saint-Hilaire, A. de;recby_problem
Hornschuchia citriodora D.M.Johnson;Hornschuchia;BR;Fazenda Serra do Teimoso. Lower forest, northern portion of reserve. Southern Bahian moist forest with elements of semi-deciduos forest.;-15.153333;-39.530556;nan;;16;3;2003;nan;2012-06-01T00:00:00;JBRJ;RB;RB00485209;0;0;0;;;0;1;6;2012;0;0;0;RB00485209;nan;citriodora;"W.W. Thomas; A.M. Amorim, S. Sant´Ana, J.L. Paixão & R.N. Querino";A.Lobão;;detby_problem;ão
Hornschuchia bryotrophe Nees;Hornschuchia;BR;Município de Maraú. ROd. Rod.BR 030, trecho Ubaitaba/Marau, km 15. Vegetação pertubada em Região de Mata Hidrográfica Sul bahiana. Folha SD 24 (14-39c).;;;nan;;5;2;1979;nan;<NA>;JBRJ;RB;RB00042161;0;0;0;;;0;;;;0;0;0;RB00042161;nan;bryotrophe;"S.A.Mori; L.A.Mattos Silva, T.S. dos Santos";J. Kallunki,;;detby_problem;,
Hornschuchia bryotrophe Nees;Hornschuchia;BR;"Árvore de até 3 metros. de altura. mata rala; infl. geralmente deitadas sobre o solo.";;;nan;;;;;nan;<NA>;JBRJ;RB;RB00042140;0;0;0;;;0;;;;0;0;0;RB00042140;nan;bryotrophe;J.G. Khulmann;D.M.Johnson (OWU);;detby_problem; (OWU)
Hornschuchia bryotrophe Nees;Hornschuchia;BR;Jard. Bot. do Rio de Janeiro.;;;nan;;;;;nan;<NA>;JBRJ;RB;RB00042137;0;0;0;;;0;;;;0;0;0;RB00042137;nan;bryotrophe;<NA>;D.M. Johnson (OWU);;<NA>;recby_problem
Hornschuchia bryotrophe Nees;Hornschuchia;BR;barra Seca, Fazenda São Carlos propriedade do Sr. Aleixo Barnabé, ca. 1,4km E da BR 101. .;;;nan;;20;2;1995;nan;1997-08-01T00:00:00;JBRJ;RB;RB00042105;0;0;0;;;0;1;8;1997;0;0;0;RB00042105;nan;bryotrophe;"José R. Pirani; JacquelynA. Kallunki, J.B Fernandes";R. Mello-Silva;;José R. Pirani;recby_problem
